{
  "active_task_id": null,
  "baseline_readiness_state": "ready_for_deploy",
  "completed_task_ids": [
    "run_build_pack_validation",
    "run_inherited_benchmarks"
  ],
  "evidence_paths": [
    "/home/adf/packfactory-source__adf-dev__autonomous-build-packs/json-health-checker-autonomy-to-promotion-build-pack-v1/.pack-state/autonomy-runs/json-health-checker-autonomy-to-promotion-build-pack-v1-continuity-run-v1/loop-events.jsonl",
    "/home/adf/packfactory-source__adf-dev__autonomous-build-packs/json-health-checker-autonomy-to-promotion-build-pack-v1/.pack-state/autonomy-runs/json-health-checker-autonomy-to-promotion-build-pack-v1-continuity-run-v1/run-summary.json"
  ],
  "final_readiness_state": "ready_for_deploy",
  "generated_at": "2026-03-25T17:33:06Z",
  "handoff_summary": [
    "Run `json-health-checker-autonomy-to-promotion-build-pack-v1-continuity-run-v1` ended with stop reason `starter_backlog_completed`.",
    "Readiness moved from `ready_for_deploy` to `ready_for_deploy`; ready_for_deployment=True.",
    "Completed tasks: run_build_pack_validation, run_inherited_benchmarks.",
    "Highest risk: `canonical_state_integrity` did not run locally; confirm canonical state before trusting the run summary.",
    "Recommended next action: use the existing bounded promotion workflow if you want to move this build-pack toward deployment."
  ],
  "highest_risk_observation": "Highest risk: `canonical_state_integrity` did not run locally; confirm canonical state before trusting the run summary.",
  "memory_id": "autonomy-feedback-json-health-checker-autonomy-to-promotion-build-pack-v1-continuity-run-v1",
  "next_recommended_task_id": null,
  "pack_id": "json-health-checker-autonomy-to-promotion-build-pack-v1",
  "ready_for_deployment": true,
  "recommended_next_action": "Recommended next action: use the existing bounded promotion workflow if you want to move this build-pack toward deployment.",
  "run_id": "json-health-checker-autonomy-to-promotion-build-pack-v1-continuity-run-v1",
  "schema_version": "autonomy-feedback-memory/v1",
  "source_artifacts": {
    "factory_validation_command": null,
    "loop_events_path": "/home/adf/packfactory-source__adf-dev__autonomous-build-packs/json-health-checker-autonomy-to-promotion-build-pack-v1/.pack-state/autonomy-runs/json-health-checker-autonomy-to-promotion-build-pack-v1-continuity-run-v1/loop-events.jsonl",
    "run_summary_path": "/home/adf/packfactory-source__adf-dev__autonomous-build-packs/json-health-checker-autonomy-to-promotion-build-pack-v1/.pack-state/autonomy-runs/json-health-checker-autonomy-to-promotion-build-pack-v1-continuity-run-v1/run-summary.json"
  },
  "summary": "Metrics `task_completion_rate`, `readiness_change_summary`, `validation_evidence_gain`, and `benchmark_evidence_gain` were computed from /home/adf/packfactory-source__adf-dev__autonomous-build-packs/json-health-checker-autonomy-to-promotion-build-pack-v1/.pack-state/autonomy-runs/json-health-checker-autonomy-to-promotion-build-pack-v1-continuity-run-v1/loop-events.jsonl, status/readiness.json, eval/latest/index.json, and tasks/active-backlog.json."
}
